{
  "schema_version": "1.0",
  "artifact_kind": "model_input",
  "bug_id": "Lang-1",
  "project": "Lang",
  "bug_number": 1,
  "status": "complete",
  "provenance": {
    "benchmark": "Defects4J",
    "version": "1b",
    "checkout_head": "1fd2290c2660ece96eebf021c7f85e66fb4a5e0d",
    "original_buggy_revision": "2c454a4ce3fe771098746879b166ede2284b94f4",
    "coverage_run_id": "20261021T035617823403Z",
    "baseline_run_id": "20261021T032719068123Z",
    "defects4j_release": "v2.0.0",
    "defects4j_commit": "01f13c69425fb8a0db290d12b1d48da1641bf6a9",
    "java_version": "openjdk version \"1.8.0_504\"\nOpenJDK Runtime Environment (Temurin)(build 1.8.0_504-b01)\nOpenJDK 64-Bit Server VM (Temurin)(build 25.504-b01, mixed mode)",
    "gzoltar_version": "v1.7.3.202203230322",
    "tree_sitter_version": "0.25.2",
    "tree_sitter_java_version": "0.23.5"
  },
  "candidate_limit": 20,
  "candidate_count": 20,
  "candidates": [
    {
      "method_id": "src/main/java/org/apache/commons/lang3/math/NumberUtils.java::org.apache.commons.lang3.math.NumberUtils#createNumber(String)",
      "source_path": "src/main/java/org/apache/commons/lang3/math/NumberUtils.java",
      "qualified_class": "org.apache.commons.lang3.math.NumberUtils",
      "method_name": "createNumber",
      "parameter_types": [
        "String"
      ],
      "start_line": 450,
      "end_line": 614,
      "source": "public static Number createNumber(final String str) throws NumberFormatException {\n        if (str == null) {\n            return null;\n        }\n        if (StringUtils.isBlank(str)) {\n            throw new NumberFormatException(\"A blank string is not a valid number\");\n        }\n        // Need to deal with all possible hex prefixes here\n        final String[] hex_prefixes = {\"0x\", \"0X\", \"-0x\", \"-0X\", \"#\", \"-#\"};\n        int pfxLen = 0;\n        for(final String pfx : hex_prefixes) {\n            if (str.startsWith(pfx)) {\n                pfxLen += pfx.length();\n                break;\n            }\n        }\n        if (pfxLen > 0) { // we have a hex number\n            final int hexDigits = str.length() - pfxLen;\n            if (hexDigits > 16) { // too many for Long\n                return createBigInteger(str);\n            }\n            if (hexDigits > 8) { // too many for an int\n                return createLong(str);\n            }\n            return createInteger(str);\n        }\n        final char lastChar = str.charAt(str.length() - 1);\n        String mant;\n        String dec;\n        String exp;\n        final int decPos = str.indexOf('.');\n        final int expPos = str.indexOf('e') + str.indexOf('E') + 1; // assumes both not present\n        // if both e and E are present, this is caught by the checks on expPos (which prevent IOOBE)\n        // and the parsing which will detect if e or E appear in a number due to using the wrong offset\n\n        int numDecimals = 0; // Check required precision (LANG-693)\n        if (decPos > -1) { // there is a decimal point\n\n            if (expPos > -1) { // there is an exponent\n                if (expPos < decPos || expPos > str.length()) { // prevents double exponent causing IOOBE\n                    throw new NumberFormatException(str + \" is not a valid number.\");\n                }\n                dec = str.substring(decPos + 1, expPos);\n            } else {\n                dec = str.substring(decPos + 1);\n            }\n            mant = str.substring(0, decPos);\n            numDecimals = dec.length(); // gets number of digits past the decimal to ensure no loss of precision for floating point numbers.\n        } else {\n            if (expPos > -1) {\n                if (expPos > str.length()) { // prevents double exponent causing IOOBE\n                    throw new NumberFormatException(str + \" is not a valid number.\");\n                }\n                mant = str.substring(0, expPos);\n            } else {\n                mant = str;\n            }\n            dec = null;\n        }\n        if (!Character.isDigit(lastChar) && lastChar != '.') {\n            if (expPos > -1 && expPos < str.length() - 1) {\n                exp = str.substring(expPos + 1, str.length() - 1);\n            } else {\n                exp = null;\n            }\n            //Requesting a specific type..\n            final String numeric = str.substring(0, str.length() - 1);\n            final boolean allZeros = isAllZeros(mant) && isAllZeros(exp);\n            switch (lastChar) {\n                case 'l' :\n                case 'L' :\n                    if (dec == null\n                        && exp == null\n                        && (numeric.charAt(0) == '-' && isDigits(numeric.substring(1)) || isDigits(numeric))) {\n                        try {\n                            return createLong(numeric);\n                        } catch (final NumberFormatException nfe) { // NOPMD\n                            // Too big for a long\n                        }\n                        return createBigInteger(numeric);\n\n                    }\n                    throw new NumberFormatException(str + \" is not a valid number.\");\n                case 'f' :\n                case 'F' :\n                    try {\n                        final Float f = NumberUtils.createFloat(numeric);\n                        if (!(f.isInfinite() || (f.floatValue() == 0.0F && !allZeros))) {\n                            //If it's too big for a float or the float value = 0 and the string\n                            //has non-zeros in it, then float does not have the precision we want\n                            return f;\n                        }\n\n                    } catch (final NumberFormatException nfe) { // NOPMD\n                        // ignore the bad number\n                    }\n                    //$FALL-THROUGH$\n                case 'd' :\n                case 'D' :\n                    try {\n                        final Double d = NumberUtils.createDouble(numeric);\n                        if (!(d.isInfinite() || (d.floatValue() == 0.0D && !allZeros))) {\n                            return d;\n                        }\n                    } catch (final NumberFormatException nfe) { // NOPMD\n                        // ignore the bad number\n                    }\n                    try {\n                        return createBigDecimal(numeric);\n                    } catch (final NumberFormatException e) { // NOPMD\n                        // ignore the bad number\n                    }\n                    //$FALL-THROUGH$\n                default :\n                    throw new NumberFormatException(str + \" is not a valid number.\");\n\n            }\n        }\n        //User doesn't have a preference on the return type, so let's start\n        //small and go from there...\n        if (expPos > -1 && expPos < str.length() - 1) {\n            exp = str.substring(expPos + 1, str.length());\n        } else {\n            exp = null;\n        }\n        if (dec == null && exp == null) { // no decimal point and no exponent\n            //Must be an Integer, Long, Biginteger\n            try {\n                return createInteger(str);\n            } catch (final NumberFormatException nfe) { // NOPMD\n                // ignore the bad number\n            }\n            try {\n                return createLong(str);\n            } catch (final NumberFormatException nfe) { // NOPMD\n                // ignore the bad number\n            }\n            return createBigInteger(str);\n        }\n\n        //Must be a Float, Double, BigDecimal\n        final boolean allZeros = isAllZeros(mant) && isAllZeros(exp);\n        try {\n            if(numDecimals <= 7){// If number has 7 or fewer digits past the decimal point then make it a float\n                final Float f = createFloat(str);\n                if (!(f.isInfinite() || (f.floatValue() == 0.0F && !allZeros))) {\n                    return f;\n                }\n            }\n        } catch (final NumberFormatException nfe) { // NOPMD\n            // ignore the bad number\n        }\n        try {\n            if(numDecimals <= 16){// If number has between 8 and 16 digits past the decimal point then make it a double\n                final Double d = createDouble(str);\n                if (!(d.isInfinite() || (d.doubleValue() == 0.0D && !allZeros))) {\n                    return d;\n                }\n            }\n        } catch (final NumberFormatException nfe) { // NOPMD\n            // ignore the bad number\n        }\n\n        return createBigDecimal(str);\n    }",
      "source_sha256": "14ebbdea51d9028d433e3605258f12ca2a2b658c0c3316017bc3031e4ac490d2",
      "method_sha256": "d5c71d6c6a9aac97609c02ddb6df7d9ca7b25b75c78b6e37656d5dc8ae8ff621",
      "ochiai_score": 0.5,
      "sbfl_rank": 1,
      "rank_min": 1,
      "rank_max": 1,
      "tie_size": 1
    },
    {
      "method_id": "src/main/java/org/apache/commons/lang3/math/NumberUtils.java::org.apache.commons.lang3.math.NumberUtils#createInteger(String)",
      "source_path": "src/main/java/org/apache/commons/lang3/math/NumberUtils.java",
      "qualified_class": "org.apache.commons.lang3.math.NumberUtils",
      "method_name": "createInteger",
      "parameter_types": [
        "String"
      ],
      "start_line": 679,
      "end_line": 685,
      "source": "public static Integer createInteger(final String str) {\n        if (str == null) {\n            return null;\n        }\n        // decode() handles 0xAABD and 0777 (hex and octal) as well.\n        return Integer.decode(str);\n    }",
      "source_sha256": "14ebbdea51d9028d433e3605258f12ca2a2b658c0c3316017bc3031e4ac490d2",
      "method_sha256": "6bd0c5f6f8dd2243071c217ca8a9230ddc59cf0ef1e71805787b7faaae7fc70d",
      "ochiai_score": 0.4472135954999579,
      "sbfl_rank": 2,
      "rank_min": 2,
      "rank_max": 2,
      "tie_size": 1
    },
    {